{
  "schema": "agentfem.scientific-function-card",
  "schema_version": "0.1.0",
  "id": "agentfem.workflow.standard_result_projection",
  "title": "Projected small-strain fields, reactions, and static equilibrium",
  "kind": "workflow",
  "status": "supported",
  "summary": "Produces engineering-default S, E, and MISES plus opt-in SENER as traceable cell-average fields, extracts MPI-global resultants, and records assembled external-force versus strong-reaction equilibrium.",
  "public_api": [
    "agentfem.results.project",
    "agentfem.results.project_piecewise",
    "agentfem.results.small_strain_cell_fields",
    "agentfem.results.small_strain_partition_fields",
    "agentfem.results.field_extrema",
    "agentfem.results.region_measure",
    "agentfem.results.reaction_resultant",
    "agentfem.results.external_force_resultant",
    "agentfem.results.static_force_balance",
    "agentfem.results.static_work_balance",
    "agentfem.mesh.tagged_boundary_region",
    "agentfem.diagnostics.linear_static_energy"
  ],
  "implementation": [
    "results/projection.py",
    "results/quantities.py",
    "diagnostics.py"
  ],
  "science": {
    "statement": "A projected result field is defined by an L2 variational problem, while a strong-constraint reaction is the unconstrained assembled residual retained on prescribed degrees of freedom.",
    "equations": [
      {
        "label": "L2 projection",
        "expression": "\\int_{\\Omega}q_h:v_h\\,dx=\\int_{\\Omega}q:v_h\\,dx\\qquad\\forall v_h",
        "description": "DG0 projection returns the cell average of a scalar, vector, or tensor expression."
      },
      {
        "label": "strong-constraint reaction",
        "expression": "\\mathbf{R}=\\mathbf{K}\\mathbf{u}-\\mathbf{F}",
        "description": "At converged free degrees of freedom R is zero to solver tolerance; prescribed degrees retain reaction entries."
      },
      {
        "label": "global static force balance",
        "expression": "\\mathbf{r}_{\\mathrm{balance}}=\\sum\\mathbf{R}_{\\mathrm{strong}}+\\sum\\mathbf{F}_{\\mathrm{assembled}}",
        "description": "The relative error is the residual norm divided by the larger external or reaction resultant norm."
      },
      {
        "label": "proportional linear work",
        "expression": "W_{\\mathrm{ext}}=\\tfrac{1}{2}\\mathbf{u}^{T}\\mathbf{F}+\\tfrac{1}{2}\\mathbf{R}_{c}^{T}\\bar{\\mathbf{u}},\\qquad U=\\tfrac{1}{2}\\mathbf{u}^{T}\\mathbf{K}\\mathbf{u}",
        "description": "Natural loads and strong prescribed values are ramped proportionally from zero; the constrained residual supplies the conjugate prescribed-motion work."
      }
    ],
    "inputs": [
      {
        "name": "displacement and material",
        "type": "finite-element displacement field, elastic properties, and Study",
        "unit_role": "consistent mechanics system",
        "description": "Defines infinitesimal strain, Cauchy stress, equivalent stress, and strain-energy density."
      },
      {
        "name": "converged problem",
        "type": "linear or nonlinear problem exposing reaction_field",
        "unit_role": "force or conjugate residual",
        "description": "Supplies the assembled residual for the strong-constraint resultant."
      }
    ],
    "outputs": [
      {
        "name": "standard fields",
        "type": "DG projected Functions named S, E, MISES, and optionally SENER",
        "unit_role": "stress, strain, and energy density",
        "description": "Serial solve_result(output=...) stores these cell fields with nodal U on one Uniform Grid."
      },
      {
        "name": "resultants, force balance, and energy closure",
        "type": "MPI-global scalar/vector, StaticForceBalance, and LinearStaticEnergy",
        "unit_role": "force and energy",
        "description": "Compact engineering histories or verification quantities."
      }
    ],
    "assumptions": [
      "Small-strain standard fields use the selected linear-elastic constitutive relation.",
      "Plane-strain isotropic Mises stress includes the constitutively implied out-of-plane stress.",
      "Reaction resultant semantics are limited to strong Dirichlet constraints."
    ],
    "conventions": [
      "DG0 is the default output space and represents a cell average.",
      "DG0 result fields are discontinuous and are not extrapolated or averaged across neighboring cells or material boundaries.",
      "The engineering default is U/S/E/MISES; SENER is an explicit diagnostic request.",
      "E means infinitesimal strain in a small-strain context.",
      "Non-zero strong prescribed-displacement work is recorded separately from natural-load work and included in total external work.",
      "Imported physical boundaries use their facet tag for both strong topological dof location and weak integration; an optional marker is audit evidence.",
      "field_extrema(location=True) identifies its finite-element-dof sampling, coordinate, rank, global dof, and DG0 cell where applicable.",
      "Model-generated linear static solids attach assembled external force, strong reaction, balance residual, and relative error to SimulationResult."
    ],
    "applicability": [
      "Linear small-strain solid mechanics, field visualization, reaction checks, and proportional load energy verification."
    ],
    "limitations": [
      "Nodal smoothing and superconvergent stress recovery are not implemented.",
      "Affine MPC, weak, and contact reactions need dedicated dual definitions; the strong-Dirichlet work formula is rejected for those assets.",
      "Thermoelastic output requires temperature-aware field construction in a later extension."
    ]
  },
  "usage": {
    "minimal_example": "support = mesh.tagged_boundary_region(domain, facet_tags, tag=101, name='support')\nresult = step.solve_result(output='solid.xdmf')\nRF_x = results.reaction_resultant(step.problem, on=support, component=0)\nbalance = results.static_force_balance(step.problem)\npeak = results.field_extrema(result.fields['MISES'], location=True)",
    "examples": ["examples/static_elasticity_2d.py"]
  },
  "verification": {
    "tests": ["tests/test_results.py", "tests/test_p1_platform.py"],
    "benchmarks": [
      "agentfem.benchmark.linear_static_cantilever",
      "agentfem.benchmark.elasticity_foundation"
    ],
    "validation_rules": [
      "Reject unknown field variables and negative projection degrees.",
      "Compare affine displacement projection with its analytical constant strain.",
      "Check named-boundary reaction equilibrium and proportional static energy closure.",
      "Check the automatically attached assembled-force, strong-reaction, and relative global balance evidence.",
      "Verify a regional two-material series bar through one piecewise projection."
    ]
  },
  "references": [
    {
      "title": "DOLFINx finite-element functions and variational assembly",
      "locator": "https://docs.fenicsproject.org/dolfinx/main/python/generated/dolfinx.fem.html"
    },
    {
      "title": "Abaqus field and history output requests",
      "locator": "https://docs.software.vt.edu/abaqusv2024/English/SIMACAEOUTRefMap/simaout-c-output.htm"
    },
    {
      "title": "Abaqus contour extrapolation and averaging",
      "locator": "https://docs.software.vt.edu/abaqusv2024/English/SIMACAECAERefMap/simacae-c-conconceptlimits.htm"
    },
    {
      "title": "COMSOL Gauss-point evaluation",
      "locator": "https://doc.comsol.com/6.4/doc/com.comsol.help.sme/sme_ug_modeling.05.224.html"
    }
  ],
  "related_cards": [
    "agentfem.workflow.result_field_sampling",
    "agentfem.operator.system_contracts"
  ]
}
