{
  "schema": "agentfem.scientific-function-card",
  "schema_version": "0.1.0",
  "id": "agentfem.workflow.cell_neighborhood_topology",
  "title": "Partition-aware cell neighborhood topology",
  "kind": "workflow",
  "status": "experimental",
  "summary": "Builds owned-facet evidence and ghost-complete local stencils, then supplies affine-exact pair differences plus rank-audited least-squares gradients and their exact transpose action for neighboring-element, DG, estimator and fracture algorithms.",
  "public_api": [
    "agentfem.assembly.assemble_cell_residual",
    "agentfem.mesh.CellNeighborhood",
    "agentfem.mesh.CellNeighborhoodGeometry",
    "agentfem.mesh.CellPairDifference",
    "agentfem.mesh.CellGradientOperator",
    "agentfem.mesh.CellGradientReconstruction",
    "agentfem.mesh.CellGradientStencil",
    "agentfem.mesh.CellStencilNeighborhood",
    "agentfem.mesh.InteriorFacetGeometry",
    "agentfem.mesh.InteriorFacetPair",
    "agentfem.mesh.cell_neighborhood",
    "agentfem.mesh.cell_neighborhood_geometry",
    "agentfem.mesh.cell_gradient_operator",
    "agentfem.mesh.cell_pair_directional_difference",
    "agentfem.mesh.cell_stencil_neighborhood",
    "agentfem.mesh.owned_cell_measures",
    "agentfem.mesh.reconstruct_cell_gradient",
    "agentfem.operators.CellGradientEnergyOperator",
    "agentfem.operators.cell_gradient_energy"
  ],
  "implementation": [
    "mesh/neighborhood.py",
    "mesh/reconstruction.py"
  ],
  "science": {
    "statement": "An interior facet is an operator stencil joining exactly two manifold cells; a partition interface must retain that two-cell meaning through ghost adjacency and must never be silently reclassified as an exterior boundary.",
    "equations": [
      {
        "label": "manifold interior-facet adjacency",
        "expression": "|\\mathcal{C}(f)|=2\\quad\\text{for every interior facet }f",
        "description": "The two-cell stencil must remain complete when one adjacent cell is a ghost on the current MPI rank."
      }
    ],
    "inputs": [
      {
        "name": "domain",
        "type": "DOLFINx mesh or AgentFEM FEMMesh",
        "unit_role": "topology",
        "description": "The mesh supplies facet-to-cell and cell-to-facet connectivity, including ghost cells at partition interfaces."
      }
    ],
    "outputs": [
      {
        "name": "cell neighborhood",
        "type": "owned interior-facet pairs and partition evidence",
        "unit_role": "runtime topology",
        "description": "Each pair records runtime local/global facet and cell indices plus the local facet number in both adjacent cells; optional geometry adds centroids, facet midpoint, center vector, distance and direction in embedding coordinates."
      },
      {
        "name": "pair directional difference",
        "type": "scalar or vector cell-value differences per center distance",
        "unit_role": "input value per length",
        "description": "The discrete operator is exact for affine cell-center data and remains explicitly distinct from a reconstructed full gradient or shell curvature."
      },
      {
        "name": "cell gradient reconstruction",
        "type": "owned-cell scalar or vector gradient plus stencil evidence",
        "unit_role": "input value per length",
        "description": "Weighted least squares uses a local SVD tangent basis and reports neighbor count, rank and condition number for every owned cell; compact neighbor weights can be cached and reapplied to many fields, and the same operator exposes its exact transpose for residual and energy-gradient construction."
      },
      {
        "name": "cell gradient energy operator",
        "type": "matrix-free energy, residual and tangent action",
        "unit_role": "declared cell weight and stiffness contract",
        "description": "One cached G evaluates 0.5 sum(w k |Gv|^2), its exact residual G^T w k Gv and the matching tangent action for scalar or vector cell fields without forming a dense global matrix."
      },
      {
        "name": "owned cell measures",
        "type": "one positive physical integration measure per owned cell",
        "unit_role": "length to the mesh topological dimension",
        "description": "A DG0 test integral provides cell-aligned weights and excludes ghost cells so rank-local energies count every global cell once."
      },
      {
        "name": "assembled DG0 cell residual",
        "type": "ghosted PETSc vector on a scalar or blocked DG0 space",
        "unit_role": "the supplied cell virtual-work contribution",
        "description": "Local and ghost cell contributions are mapped by explicit cell identity, reverse-scattered with addition to owners, and forward-scattered for a consistent distributed vector."
      }
    ],
    "assumptions": [
      "The domain is a manifold mesh with one cell at an exterior facet and two cells at an interior facet.",
      "Distributed meshes include the ghost-cell adjacency required by the consuming operator."
    ],
    "conventions": [
      "Only owned facets are emitted, so each global interior facet is represented once across MPI ranks.",
      "Cell pairs are ordered by runtime global cell index for deterministic local execution."
    ],
    "applicability": [
      "Rotation-free neighboring-element shells, discontinuous Galerkin operators, local error estimation and crack-neighborhood algorithms."
    ],
    "limitations": [
      "Runtime global indices depend on the mesh partition and are not scientific model identity or restart identity.",
      "The contract does not define a shell curvature, bending virtual work, or forming solver; reconstructed gradients must still pass field-specific patch and convergence tests.",
      "Callers must synchronize ghost cell values before evaluating a distributed pair difference or gradient reconstruction.",
      "The transpose returns local and ghost-cell contributions; distributed residual assembly must reverse-scatter ghost contributions to their owning ranks."
    ]
  },
  "usage": {
    "minimal_example": "gradient = mesh.cell_gradient_operator(domain, rings=2); energy = operators.cell_gradient_energy(gradient, cell_weights=weights, stiffness=k); residual = energy.residual(cell_values)",
    "examples": [
      "tests/test_mesh_neighborhood.py",
      "tests/test_parallel_mesh_semantics.py"
    ]
  },
  "verification": {
    "tests": [
      "tests/test_mesh_neighborhood.py",
      "tests/test_parallel_mesh_semantics.py"
    ],
    "benchmarks": [],
    "validation_rules": [
      "Recover exact interior and exterior facet counts on triangle and quadrilateral meshes.",
      "Retain both local-facet positions and deterministic cell ordering.",
      "Recover translation-invariant center vectors, distances and directions from embedding coordinates.",
      "Recover the exact directional derivative of affine scalar and vector cell-center fields.",
      "Recover affine-exact scalar and vector full gradients on triangle and quadrilateral meshes while rejecting rank-deficient or ill-conditioned stencils.",
      "Reuse one geometry-cached compact operator across fields and annihilate arbitrary constant offsets exactly.",
      "Satisfy the scalar and vector inner-product identity between the cached gradient action and its exact transpose, including rank-local ghost contributions under two MPI ranks.",
      "Match finite-difference energy derivatives with the exact residual, retain a symmetric positive-semidefinite tangent, and preserve constant fields as an exact zero-energy mode.",
      "Recover the exact rectangle area on triangular and quadrilateral meshes and count the unit-square area exactly once across two MPI ranks.",
      "Assemble scalar and vector DG0 cell contributions by cell identity and recover global energy-directional-derivative work after ghost reverse scatter under two MPI ranks.",
      "Under two MPI ranks, count every global interior facet exactly once and retain a ghost adjacent cell across partition interfaces."
    ]
  },
  "references": [
    {
      "title": "Bai et al. (2024), Influence of in-plane bending behaviour on textile composite reinforcement forming",
      "locator": "https://doi.org/10.1016/j.ijmecsci.2024.109206"
    },
    {
      "title": "Steer et al. (2021), rotation-free in-plane bending of fibrous reinforcements",
      "locator": "https://doi.org/10.1016/j.ijsolstr.2021.03.001"
    }
  ],
  "related_cards": [
    "agentfem.material.fabric_surface_constitutive",
    "agentfem.verification.discrete_inf_sup_evidence"
  ]
}
